{
  "$schema": "https://json-schema.org/draft/2020-12/schema",
  "$id": "yaaw.observed-state/v4",
  "type": "object",
  "required": ["schema","framework","repository","derived","reconstructable","artifacts","inconsistencies","candidate_actions","reconciliation"],
  "properties": {
    "schema":{"const":"yaaw.observed-state/v4"},
    "framework":{"type":"object"},
    "repository":{"$ref":"repository-identity.schema.json"},
    "derived":{"type":"object"},
    "reconstructable":{"const":true},
    "artifacts":{"type":"object"},
    "inconsistencies":{"type":"array","items":{"type":"string"}},
    "candidate_actions":{"type":"array","items":{"type":"string"}},
    "reconciliation":{"anyOf":[{"type":"null"},{"type":"object","required":["id","kind","reason"],"properties":{"id":{"type":"string"},"kind":{"enum":["TICKET_STATUS","BLOCKED"]},"subject":{"type":["string","null"]},"from":{},"to":{},"reason":{"type":"string"},"workflow":{"type":["string","null"]},"evidence":{"type":"array","items":{"type":"string"}}},"additionalProperties":true}]}
  },
  "additionalProperties":false
}
