{
  "schema": "yaaw.observed-state/v4",
  "framework": {},
  "repository": {"schema":"yaaw.repository-identity/v2","algorithm":null,"status":"UNVERSIONED","workspace_scope":".","git_root_relation":"none","head_commit":null,"dirty":null,"worktree_digest":null,"components":null,"changed_paths":[],"error":"workspace is not versioned"},
  "derived": {},
  "reconstructable": true,
  "artifacts": {},
  "inconsistencies": [],
  "candidate_actions": [],
  "reconciliation": null
}
